<?xml version="1.0" encoding="UTF-8"?>
<!DOCTYPE install SYSTEM "http://web.magti.ge/pda/defines/xml/edit.dtd">
<install type="component" version="1.5.0">
	<params>
		<param name="LIB_TITLE" type="text" default="" label="Title" must="1" geokbd="1" />
		<param name="LIB_DESC" type="text" default="" label="Description" geokbd="1" />
		<param name="ORG" type="myorg" default="" label="ORG"  must="1" />
		<param name="GROUPS" type="mygroupsrel" default="" label="GROUPS" must="1" />
		<param name="ACTIVE" type="radio" default="1">
			<option value="1">Active Status</option>
			<option value="0">Inactive</option>
		</param>
		<param name="ID" type="hidden" default="" />
	</params>
	<params group="details">
		<param name="START_TIME" type="time" default="" label="Max_START_TIME" must="1" />
		<param name="MIN_WORKING_HOUR" type="number" default="" label="MIN_WORKING_HOUR" must="1"/>
		<param name="MAX_WORKING_HOUR" type="number" default="" label="MAX_WORKING_HOUR" must="1"/>
		<!--		<param name="END_TIME" type="time" default="" label="END_TIME" must="1" />-->
		<!--		<param name="START_BREAK" type="time" default="" label="START_BREAK" />
		<param name="END_BREAK" type="time" default="" label="END_BREAK" />-->
		<param name="REST_MINUTES" type="number" default="" label="REST_MINUTES" must="1"/>
		<param name="HOLIDAY_YN" type="radio" default="" must="1">
			<option value="1">Yes</option>
			<option value="0">No</option>
		</param>
		<param name="COLOR" type="color" default="#990000" label="COLOR" />
		<param name="VACATION_INDEX" type="number" default="1" label="VACATION_INDEX" must="1" step="0.5" />
		<param name="TIME_CODE" type="text" default="" label="code" />
	</params>
</install>
